"id","title","characterOne_name","characterTwo_name","biography","iconId"
"t_001","Altar and Ambiv","Altar","Ambiv","These aliens are from a distant land.","t_001"
"t_002","Betty and Bagolda","Betty","Bagolda","These aliens have trombones for hands.","t_002"
"t_003","Carlos and Cuthbert","Carlos","Cuthbert","These aliens want to absorb as much as possible.","t_003"
"t_004","Dolores and Ducky","Dolores","Ducky","These aliens are made of elastic and bounce everywhere.","t_004"
"t_005","Egart and Esta","Egart","Esta","These aliens will be forever remembered as martyrs.","t_005"
"t_006","Frogpit and Froom","Frogpit","Froom","These aliens own a megacorp made of millions of employees and one star whale.","t_006"